{
  "schema_version":"jizz.research-index.v0.1",
  "generated_from_latest_candidate_at":"2026-09-12T00:38:50Z",
  "counts":{"total":2,"active":1,"merged":1,"rejected":0,"by_status":{"ready_for_observation":1,"merged":1}},
  "lanes":[
    {"id":"ai-workforce-discourse","candidate_type":"technology / labor perspective","zone_hint":"ECONOMIC","active_candidates":0},
    {"id":"technology-regulation-discourse","candidate_type":"technology / regulation perspective","zone_hint":"TECHNICAL","active_candidates":0},
    {"id":"cost-of-living-discourse","candidate_type":"economic public perspective","zone_hint":"ECONOMIC","active_candidates":0},
    {"id":"climate-policy-discourse","candidate_type":"climate / policy perspective","zone_hint":"GLOBAL","active_candidates":0},
    {"id":"science-health-discourse","candidate_type":"science / health perspective","zone_hint":"SCIENTIFIC","active_candidates":0},
    {"id":"geopolitical-discourse","candidate_type":"geopolitical perspective","zone_hint":"POLITICAL","active_candidates":0},
    {"id":"digital-culture-discourse","candidate_type":"digital / cultural perspective","zone_hint":"DIGITAL","active_candidates":0},
    {"id":"cultural-heritage-discourse","candidate_type":"cultural heritage / identity perspective","zone_hint":"CULTURAL","active_candidates":1}
  ],
  "candidates":[
    {"id":"CAND-JIZZ-KALEVALA-HERITAGE-IDENTITY-FRAMING-AB2A63AF","title":"Kalevala heritage and identity framing","status":"merged","lane_id":"cultural-heritage-discourse","zone_hint":"CULTURAL","source_count":3,"discovered_at":"2026-09-11T01:00:28Z"},
    {"id":"CAND-JIZZ-TE-TIRITI-CROWN-IWI-CONSTITUTIONAL-FRAMING-83BA88D9","title":"Te Tiriti Crown iwi constitutional and public-history framing","status":"ready_for_observation","lane_id":"cultural-heritage-discourse","zone_hint":"CULTURAL","source_count":1,"discovered_at":"2026-09-10T12:40:54Z"}
  ]
}